{
  "$schema": "https://json-schema.org/draft/2020-12/schema",
  "$id": "urn:vate:conformance:al2-vate-v0.2:case",
  "title": "VATE AL2 v0.2 Conformance Case",
  "description": "Minimal machine-readable conformance case shape for the VATE AL2 verifier admission profile v0.2.",
  "type": "object",
  "required": [
    "version",
    "profile",
    "case_id",
    "title",
    "category",
    "purpose",
    "artifacts",
    "expected"
  ],
  "properties": {
    "version": {
      "type": "string",
      "const": "vate-conformance-0.2"
    },
    "profile": {
      "type": "string",
      "const": "VATE-AL2-Verifier-Admission-v0.2"
    },
    "case_id": {
      "type": "string",
      "minLength": 1
    },
    "title": {
      "type": "string",
      "minLength": 1
    },
    "category": {
      "type": "string",
      "enum": [
        "positive",
        "negative",
        "linkage"
      ]
    },
    "purpose": {
      "type": "string",
      "minLength": 1
    },
    "artifacts": {
      "type": "object",
      "properties": {
        "a2a_metadata": {
          "type": "string",
          "minLength": 1
        },
        "admission_request": {
          "type": "string",
          "minLength": 1
        },
        "admission_receipt": {
          "type": "string",
          "minLength": 1
        },
        "policy_snapshot": {
          "type": "string",
          "minLength": 1
        },
        "post_execution_receipt": {
          "type": "string",
          "minLength": 1
        },
        "base_artifact": {
          "type": "string",
          "minLength": 1
        },
        "mutation": {
          "type": "object",
          "additionalProperties": true
        }
      },
      "additionalProperties": true
    },
    "expected": {
      "type": "object",
      "required": [
        "should_execute",
        "reason_codes",
        "checks"
      ],
      "properties": {
        "admission_decision": {
          "type": "string",
          "description": "Verifier-side admission decision before execution. This is always allow, attenuate, or deny.",
          "enum": [
            "allow",
            "attenuate",
            "deny"
          ]
        },
        "post_execution_outcome": {
          "type": "string",
          "description": "Post-execution receipt result outcome. This is separate from the admission decision vocabulary.",
          "enum": [
            "success",
            "partial_success",
            "failed",
            "cancelled"
          ]
        },
        "should_execute": {
          "type": "boolean"
        },
        "reason_codes": {
          "type": "array",
          "items": {
            "type": "string",
            "minLength": 1
          }
        },
        "checks": {
          "type": "array",
          "items": {
            "type": "object",
            "required": [
              "name",
              "expected"
            ],
            "properties": {
              "name": {
                "type": "string",
                "minLength": 1
              },
              "expected": {
                "type": "string",
                "enum": [
                  "pass",
                  "fail",
                  "present",
                  "absent"
                ]
              }
            },
            "additionalProperties": true
          }
        }
      },
      "additionalProperties": true
    },
    "validation_focus": {
      "type": "array",
      "items": {
        "type": "string",
        "minLength": 1
      }
    },
    "policy_snapshot_checks": {
      "type": "array",
      "description": "Checks that a policy snapshot artifact digest matches or intentionally does not match the digest-bound references in receipts or metadata.",
      "items": {
        "type": "object",
        "required": [
          "artifact"
        ],
        "properties": {
          "artifact": {
            "type": "string",
            "minLength": 1
          },
          "expect_match": {
            "type": "boolean"
          },
          "reference_paths": {
            "type": "array",
            "items": {
              "type": "object",
              "required": [
                "artifact",
                "path"
              ],
              "properties": {
                "artifact": {
                  "type": "string",
                  "enum": [
                    "admission_receipt",
                    "a2a_metadata"
                  ]
                },
                "path": {
                  "type": "string",
                  "minLength": 1
                }
              },
              "additionalProperties": true
            }
          },
          "compare_fields": {
            "type": "array",
            "items": {
              "type": "string",
              "minLength": 1
            }
          }
        },
        "additionalProperties": true
      }
    },
    "artifact_reference_checks": {
      "type": "array",
      "description": "Checks that any referenced artifact digest matches digest-bound references in requests, receipts, or metadata.",
      "items": {
        "type": "object",
        "required": [
          "artifact",
          "reference_paths"
        ],
        "properties": {
          "artifact": {
            "type": "string",
            "minLength": 1
          },
          "expect_match": {
            "type": "boolean"
          },
          "reference_paths": {
            "type": "array",
            "items": {
              "type": "object",
              "required": [
                "artifact",
                "path"
              ],
              "properties": {
                "artifact": {
                  "type": "string",
                  "enum": [
                    "admission_request",
                    "admission_receipt",
                    "post_execution_receipt",
                    "a2a_metadata"
                  ]
                },
                "path": {
                  "type": "string",
                  "minLength": 1
                }
              },
              "additionalProperties": true
            }
          }
        },
        "additionalProperties": true
      }
    },
    "attenuation_checks": {
      "type": "array",
      "description": "Checks that an attenuation object is valid or invalid under the AL2 attenuation boundary rules.",
      "items": {
        "type": "object",
        "required": [
          "artifact",
          "expect_valid"
        ],
        "properties": {
          "artifact": {
            "type": "string",
            "minLength": 1
          },
          "source_path": {
            "type": "string",
            "minLength": 1
          },
          "expect_valid": {
            "type": "boolean"
          },
          "expected_failure_reason": {
            "type": "string",
            "minLength": 1
          }
        },
        "additionalProperties": true
      }
    },
    "al2_context_checks": {
      "type": "array",
      "description": "Checks minimum AL2 verification context such as freshness, replay, and binding inputs.",
      "items": {
        "type": "object",
        "required": [
          "kind",
          "artifact"
        ],
        "properties": {
          "kind": {
            "type": "string",
            "enum": [
              "freshness",
              "binding",
              "replay"
            ]
          },
          "artifact": {
            "type": "string",
            "minLength": 1
          },
          "expect_fresh": {
            "type": "boolean"
          },
          "max_age_seconds": {
            "type": "integer",
            "minimum": 0
          },
          "expect_match": {
            "type": "boolean"
          },
          "expect_replayed": {
            "type": "boolean"
          },
          "expected_failure_reason": {
            "type": "string",
            "minLength": 1
          }
        },
        "additionalProperties": true
      }
    },
    "trust_checks": {
      "type": "array",
      "description": "Checks local trust-bundle admission behavior for issuer, key id, algorithm, evidence type, status, and validity windows.",
      "items": {
        "type": "object",
        "required": [
          "trust_bundle",
          "issuer_id",
          "kid",
          "evidence_type",
          "expect_trusted"
        ],
        "properties": {
          "trust_bundle": {
            "type": "string",
            "minLength": 1
          },
          "issuer_id": {
            "type": "string",
            "minLength": 1
          },
          "kid": {
            "type": "string",
            "minLength": 1
          },
          "alg": {
            "type": "string",
            "minLength": 1
          },
          "evidence_type": {
            "type": "string",
            "minLength": 1
          },
          "checked_at": {
            "type": "string",
            "format": "date-time"
          },
          "expect_trusted": {
            "type": "boolean"
          },
          "expected_failure_reason": {
            "type": "string",
            "minLength": 1
          }
        },
        "additionalProperties": true
      }
    },
    "jose_checks": {
      "type": "array",
      "description": "Checks dependency-free detached JWS fixture behavior for protected headers, payload bytes, signing input, and trust-bundle binding.",
      "items": {
        "type": "object",
        "required": [
          "proof_package",
          "detached_payload",
          "trust_bundle",
          "expect_valid"
        ],
        "properties": {
          "proof_package": {
            "type": "string",
            "minLength": 1
          },
          "detached_payload": {
            "type": "string",
            "minLength": 1
          },
          "trust_bundle": {
            "type": "string",
            "minLength": 1
          },
          "checked_at": {
            "type": "string",
            "format": "date-time"
          },
          "expected_typ": {
            "type": "string",
            "minLength": 1
          },
          "expect_valid": {
            "type": "boolean"
          },
          "expected_failure_reason": {
            "type": "string",
            "minLength": 1
          }
        },
        "additionalProperties": true
      }
    }
  },
  "allOf": [
    {
      "if": {
        "properties": {
          "category": {
            "enum": [
              "positive",
              "negative"
            ]
          }
        },
        "required": [
          "category"
        ]
      },
      "then": {
        "properties": {
          "expected": {
            "required": [
              "admission_decision"
            ]
          }
        }
      }
    },
    {
      "if": {
        "properties": {
          "category": {
            "const": "linkage"
          }
        },
        "required": [
          "category"
        ]
      },
      "then": {
        "properties": {
          "expected": {
            "required": [
              "post_execution_outcome"
            ]
          }
        }
      }
    }
  ],
  "additionalProperties": true
}
