{
  "version": "vate-conformance-0.2",
  "profile": "VATE-AL2-Verifier-Admission-v0.2",
  "case_id": "post-execution-after-admission-expiry",
  "title": "Reject execution after admission expiry",
  "category": "linkage",
  "purpose": "A verifier or auditor should reject post-execution evidence when execution starts after the admission receipt expiry.",
  "artifacts": {
    "admission_receipt": "examples/receipts/admission-attenuate-max-amount.example.json",
    "post_execution_receipt": "examples/receipts/post-execution-after-admission-expiry.example.json"
  },
  "expected": {
    "post_execution_outcome": "failed",
    "should_execute": true,
    "reason_codes": [
      "POST_EXEC_LINKAGE_MISMATCH"
    ],
    "checks": [
      {
        "name": "post_execution.execution.started_at",
        "expected": "present"
      },
      {
        "name": "result.policy_violations",
        "expected": "fail"
      }
    ]
  },
  "validation_focus": [
    "post-execution linkage",
    "admission expiry"
  ]
}
