{
  "version": "vate-conformance-0.2",
  "profile": "VATE-AL2-Verifier-Admission-v0.2",
  "case_id": "allow-mcp-oauth-transport-bound",
  "title": "Allow an MCP OAuth-bound tool invocation",
  "category": "positive",
  "purpose": "A verifier should preserve transport-binding evidence when an MCP tool invocation is admitted through OAuth and OpenID evidence.",
  "artifacts": {
    "admission_request": "examples/transport/mcp-oauth-admission-request.example.json",
    "admission_receipt": "examples/receipts/admission-allow-mcp-oauth-bound.example.json"
  },
  "expected": {
    "admission_decision": "allow",
    "should_execute": true,
    "reason_codes": [
      "EVIDENCE_VERIFIED",
      "POLICY_MATCH"
    ],
    "checks": [
      {
        "name": "decision.outcome",
        "expected": "pass"
      },
      {
        "name": "request.audience",
        "expected": "pass"
      },
      {
        "name": "request.transport.protocol",
        "expected": "present"
      },
      {
        "name": "request.transport.oauth.audience",
        "expected": "present"
      },
      {
        "name": "request.transport.openid.subject",
        "expected": "present"
      },
      {
        "name": "evidence[0].protocol_hint",
        "expected": "present"
      },
      {
        "name": "evidence[1].protocol_hint",
        "expected": "present"
      },
      {
        "name": "evidence.verification.result",
        "expected": "pass"
      }
    ]
  },
  "validation_focus": [
    "MCP transport binding",
    "OAuth audience binding",
    "OpenID subject binding",
    "runtime binding"
  ]
}
