{
  "version": "vate-conformance-0.2",
  "profile": "VATE-AL2-Verifier-Admission-v0.2",
  "case_id": "deny-status-stale-just-over-boundary",
  "title": "Deny status evidence just beyond the freshness boundary",
  "category": "negative",
  "purpose": "A verifier should fail closed when checked_at is one second beyond max_age_seconds after source_issued_at.",
  "artifacts": {
    "admission_receipt": "examples/receipts/admission-deny-status-stale-just-over-boundary.example.json",
    "status_context": "conformance/al2-vate-v0.2/fixtures/status-stale-just-over-boundary-context.json"
  },
  "al2_context_checks": [
    {
      "kind": "freshness",
      "artifact": "status_context",
      "expect_fresh": false,
      "expected_failure_reason": "STATUS_STALE"
    }
  ],
  "expected": {
    "admission_decision": "deny",
    "should_execute": false,
    "reason_codes": [
      "STATUS_STALE",
      "FAIL_CLOSED"
    ],
    "checks": [
      {
        "name": "decision.outcome",
        "expected": "fail"
      },
      {
        "name": "evidence.verification.failure_reason",
        "expected": "present"
      }
    ]
  },
  "validation_focus": [
    "status freshness",
    "boundary condition",
    "fail closed"
  ]
}
