{
  "version": "vate-conformance-0.2",
  "profile": "VATE-AL2-Verifier-Admission-v0.2",
  "case_id": "deny-runtime-proof-stale",
  "title": "Deny a stale runtime proof before policy admission",
  "category": "negative",
  "purpose": "A verifier should fail closed when runtime proof freshness fails before local policy or attenuation evaluation can permit execution.",
  "artifacts": {
    "admission_request": "examples/admission-request-runtime-proof-stale.example.json",
    "admission_receipt": "examples/receipts/admission-deny-runtime-proof-stale.example.json"
  },
  "expected": {
    "admission_decision": "deny",
    "should_execute": false,
    "reason_codes": [
      "RUNTIME_PROOF_STALE",
      "FAIL_CLOSED"
    ],
    "checks": [
      {
        "name": "decision.outcome",
        "expected": "fail"
      },
      {
        "name": "evidence.verification.result",
        "expected": "fail"
      },
      {
        "name": "evidence.verification.failure_reason",
        "expected": "present"
      },
      {
        "name": "policy.policy_version",
        "expected": "present"
      }
    ]
  },
  "validation_focus": [
    "runtime proof freshness",
    "evaluation order",
    "fail closed before policy allow",
    "execution gate"
  ]
}
