{
  "version": "vate-conformance-0.2",
  "profile": "VATE-AL2-Verifier-Admission-v0.2",
  "case_id": "deny-jose-hs256-downgrade",
  "title": "Deny detached JWS fixture using HS256 downgrade",
  "category": "negative",
  "purpose": "A verifier should fail closed when a protected JOSE header attempts to downgrade an asymmetric runtime evidence trust anchor to a symmetric algorithm.",
  "artifacts": {
    "admission_receipt": "examples/receipts/admission-deny-jose-hs256-downgrade.example.json",
    "jose_proof": "examples/jose/jose-detached-runtime-attestation-hs256-downgrade.example.json",
    "detached_payload": "examples/jose/detached-runtime-attestation-payload.json",
    "trust_bundle": "examples/trust-bundle.example.json"
  },
  "jose_checks": [
    {
      "proof_package": "jose_proof",
      "detached_payload": "detached_payload",
      "trust_bundle": "trust_bundle",
      "checked_at": "2026-07-01T00:17:05Z",
      "expected_typ": "vate-evidence+jws",
      "expect_valid": false,
      "expected_failure_reason": "ALG_NOT_ALLOWED"
    }
  ],
  "expected": {
    "admission_decision": "deny",
    "should_execute": false,
    "reason_codes": [
      "ALG_NOT_ALLOWED",
      "FAIL_CLOSED"
    ],
    "checks": [
      {
        "name": "decision.outcome",
        "expected": "fail"
      },
      {
        "name": "jose.protected_header",
        "expected": "pass"
      },
      {
        "name": "jose.detached_payload_digest",
        "expected": "pass"
      },
      {
        "name": "jose.signing_input",
        "expected": "pass"
      },
      {
        "name": "evidence.verification.failure_reason",
        "expected": "present"
      }
    ]
  },
  "validation_focus": [
    "detached JWS fixture",
    "algorithm confusion",
    "algorithm allowlist",
    "fail closed"
  ]
}
