{
  "version": "vate-conformance-0.2",
  "profile": "VATE-AL2-Verifier-Admission-v0.2",
  "case_id": "deny-ambiguous-trust-anchor",
  "title": "Deny an ambiguous trust anchor",
  "category": "negative",
  "purpose": "A verifier should fail closed when more than one trust anchor matches the presented issuer and key id.",
  "artifacts": {
    "trust_bundle": "examples/trust-bundle-ambiguous.example.json",
    "admission_receipt": "examples/receipts/admission-deny-ambiguous-trust-anchor.example.json"
  },
  "trust_checks": [
    {
      "trust_bundle": "trust_bundle",
      "issuer_id": "did:web:agent.example",
      "kid": "did:web:agent.example#runtime-key-1",
      "alg": "ES256",
      "evidence_type": "runtime_attestation",
      "checked_at": "2026-07-01T00:14:05Z",
      "expect_trusted": false,
      "expected_failure_reason": "SCHEMA_INVALID"
    }
  ],
  "expected": {
    "admission_decision": "deny",
    "should_execute": false,
    "reason_codes": [
      "SCHEMA_INVALID",
      "FAIL_CLOSED"
    ],
    "checks": [
      {
        "name": "decision.outcome",
        "expected": "fail"
      },
      {
        "name": "evidence.verification.failure_reason",
        "expected": "present"
      }
    ]
  },
  "validation_focus": [
    "trust bundle",
    "ambiguous issuer key binding",
    "fail closed"
  ]
}
